id,sku,short_description,price,list_price,price_usd,discount,discount_rate,review_count,order_count,inventory_status,is_visible,stock_item_qty,stock_item_max_sale_qty,product_name,brand_id,brand_name
88928273,7263962004010,"       Khăn ướt ngừa hăm & rôm sảy Mamamy - duy nhất được HỘI SẢN PHỤ KHOA VIỆT NAM khuyên dùng.   • Không hóa chất bảo quản(Paraben, MIT...).   • Diệt khuẩn từng tờ bằng tia cực tím.   Số ...",323000.0,323000.0,,,,163.0,,available,,1000.0,1000.0,Combo 10 Gói Khăn Ướt Trẻ Em MAMAMY 100 Tờ,79709,Mamamy
270845223,3798456196808,Sữa bột công thức Meiji Hohoemi Milk cho bé 1 đến 3 tuổi (800g) Nhập khẩu Nhật Bao bì sản phẩm sẽ thay đổi theo từng đợt nhập hàngSữa công thức luôn là mối quan tâm hàng đầu của các bà mẹ bỉm sữa...,415000.0,415000.0,,,,,,available,,1000.0,1000.0,"Sữa cho bé 1 đến 3 tuổi Meiji nội địa Nhật giúp bé phát triển cân đối chiều cao, cân nặng, trí não - QuaTangMe Extaste",144936,Meiji
145512639,1184610413887,"Nút Che Bịt Ổ Điện Chắc Chắn An Toàn Cho Bé- Nút bịt ổ điện được sử dụng rộng rãi cho tất cả các gia đình, đặc biệt là những gia đình có em bé. - Với công dụng giúp che kín các lỗ của ổ cắm hạn chế ...",1881.0,1900.0,,19.0,1.0,8.0,,available,,1000.0,1000.0,Nút Che Bịt Ổ Điện Chắc Chắn An Toàn Cho Bé,111461,OEM
71080136,1260790952463,"Hệ xương khớp chắc khỏeVới Canxi và Vitamin K2, Sure Prevent Gold HT 900g được bổ sung thêm Collagen thủy phân - thành phần chính cấu tạo nên sụn khớp, giúp hỗ trợ hệ xương khớp chắc khỏe.Giảm Chole...",579000.0,579000.0,,,,29.0,,available,,1000.0,1000.0,Sure Prevent Gold HT 900g,65122,Vinamilk
130461472,7721839259675,"Sữa Bột Similac Einstein 3 là thức uống dinh dưỡng dành cho bé sơ sinh từ 1 đến 2 tuổi, hỗ trợ sự phát triển não bộ và tăng sức đề kháng cho bé với hệ dưỡng chất IQ Plus và 2'FL HMO.Giúp trẻ phát tr...",510000.0,510000.0,,,,162.0,,available,,1000.0,1000.0,Sữa Bột Similac Einstein 3,149735,Similac
62253018,6820953849006,"Thuốc diệt mối , diệt côn trùng 473ml dạng xịt phòng ngừa mối, mọt tận gốc cao cấpBAO BÌ THAY ĐỔI THEO TỪNG ĐỢT NHẬP HÀNGCông Dụng Của Diệt Mối Tận Gốc Sifa :Dầu trừ mối Sifa là loại thuốc diệt cô...",62000.0,62000.0,,,,18.0,,available,,1000.0,1000.0,"Thuốc diệt mối , diệt côn trùng 500g - thể tích thực 473ml dạng xịt phòng ngừa mối, mọt tận gốc cao cấp  ",194565,Sifa
68179518,8895813574426,"* Nước Tẩy Nhà Tắm Mao Bao 600ml có đặc điểm:- Loại bỏ hoàn toàn các vết cáu bẩn, khử nấm mốc, bảo dưỡng và làm sáng bóng các thiết bị nhà tắm.- Trung tính, an toàn: Không có Sodium Hypochiorite &am...",44000.0,50000.0,,6000.0,12.0,25.0,,available,,1000.0,1000.0,Nước Tẩy Nhà Tắm Mao Bao 600ml,46622,Mao Bao
76072139,9777274643820,Bộ xe 6 công trình xây dựng tỉ lệ 1:64 xe cẩu xe tải các loại Bộ sản phầm gồm 06 loại xe khác nhau mô hình thu nhỏ tỉ lệ 1:64 Bao gồm các xe : xe tải xe lu xe cẩu xe xúc xe nâ Xe die cast được làm bằn...,129000.0,129000.0,,,,237.0,,available,,1000.0,1000.0,"Xe công trình xây dựng bằng kim loại  KAVY gồm 6 xe chi tiết sắc sảo, an toàn cho bé, dùng làm đồ chơi trẻ em hoặc trang trí",4401601,KAVY
34537693,6927456453225,Tã Dán Siêu Thấm Caryn Gói Siêu Tiết Kiệm M-L40 (40 Miếng) - Tã dán Siêu thấm Caryn với cải tiến “Rãnh thấm siêu tốc’ duy nhất trên thị trường giúp tăng cường độ thấm hút và giữ bề mặt tã luôn khô tho...,399000.0,399000.0,,,,39.0,,available,,1000.0,1000.0,Tã Dán Siêu Thấm Caryn Gói Siêu Tiết Kiệm L40 (40 Miếng),47776,Caryn
170331247,5109917337102,GẠC RƠ LƯỠI ORIBEBE VỆ SINH RĂNG MIỆNG CHO BÉ HỘP 30 GÓI *Bao bì sản phẩm có thể thay đổi theo từng đợt nhập hàng Gạc răng miệng y tế Oribebe được xem là một trong những “trợ thủ đắc lực” để làm sạ...,116000.0,165000.0,,49000.0,30.0,18.0,,available,,1000.0,1000.0,Gạc Rơ Lưỡi Oribebe Vệ Sinh Răng Miệng Cho Bé Hộp 30 Gói,4698877,Oribebe
6217533,4098189528589,"NƯỚC RỬA CHÉN TRUNG TÍNH HƯƠNG TÁO XANH ROCKET 500G (TÚI REFILL)Xuất xứ: Nhật BảnThành phần: chất hoạt tính bề mặt, chất ổn định, oxyHạn sử dụng: 36 tháng từ ngày sản xuất. Sản phẩm được bán bảo đả...",28000.0,36000.0,,8000.0,22.0,10.0,,available,,1000.0,1000.0,Nước Rửa Chén Hương Táo Loại Túi (500ml) Rocket,111461,OEM
68612841,5496336464848,...,310000.0,420000.0,,110000.0,26.0,,,available,,1000.0,1000.0,Combo 2 túi nước giặt xả Maxkleen hương Vườn Sớm Mai 3.8kg/túi ,154192,MaxKleen
95082968,6200534820999,"Sữa bột Enfamil A2 Neuropro 2 là sản phẩm dinh dưỡng công thức cho trẻ từ 6- 12 tháng tuổi.Sữa bột Enfamil A2 Neuropro 2 là sản phẩm sữa công thức cao cấp với nguồn dinh dưỡng hoàn chỉnh, với thành ...",659000.0,659000.0,,,,81.0,,available,,1000.0,1000.0,Sữa bột Enfamil A2 Neuropro 2 cho trẻ từ 6 - 12 tháng tuổi – 800g,112338,Enfa
249030271,3387390891092,"Sữa bột Ensure hương Vanila 850 Grams - Nhập khẩu AustraliaMẫu mới Ensure Australia 2018Sản phẩm bán tại Tiki luôn là mẫu mới nhất, bao bì sản phẩm có thể được thay đổi theo từng lô hàng nhậpThươn...",2132000.0,2132000.0,,,,670.0,,available,,1000.0,1000.0,"Ensure Úc sữa cho người lớn Giúp hồi phục sức khỏe cho người gầy yếu, người suy dinh dưỡng - QuaTangMe Extaste",33283,Abbott
70640837,7810424006754,"Xịt Phòng Tinh Dầu Hữu Cơ Organic 24Care 250ML - Tiết kiệm: Đầu xịt bền bỉ, với hơn 1000 lần xịt trọn vẹn, khử mùi chỉ với dưới 100đ một lần, tiết kiệm tối đa. - An toàn: Với thành phần h...",112000.0,149000.0,,37000.0,25.0,313.0,,available,,1000.0,1000.0,"Xịt Phòng Tinh Dầu Thảo Mộc Hữu Cơ Organic 24Care 250ML - Kháng khuẩn - Khử mùi hôi - Đuổi muỗi, côn trùng - Tập trung tinh thần làm việc, lái xe, học hành - Hương thơm thư giãn.",248385,24Care
116452634,9594366733997,...,68000.0,99000.0,,31000.0,31.0,121.0,,available,,1000.0,1000.0,Khăn giấy bếp PREMIER VinaRoll 2 cuộn/gói - Combo 3 gói,5112707,PREMIER VinaRoll
543129,7905387732502,Dung Dịch Giặt Quần Áo Cho Bé D-Nee - Chai 3000ml (Xanh) với hương thơm nhẹ nhàng như ánh nắng mặt trời cùng độ pH trung tính không làm tổn thương da tay. Sản phẩm giúp làm sạch quần áo em bé nhờ công...,215000.0,215000.0,,,,16.0,,available,,1000.0,1000.0,Dung Dịch Giặt Quần Áo Cho Bé D-Nee - Chai 3000ml (Xanh),64201,D-nee
10054502,1445195614561,"Thùng 48 Hộp Sữa Bột Pha Sẵn Friso Gold Rtd Vani (48 x 180ml) là nguồn dưỡng chất hỗ trợ cho bé tăng sức đề kháng khi bé bắt đầu khám phá thế giới.Khi đến tuổi đi học, bé bắt đầu có nhiều trải nghi...",647000.0,807000.0,,160000.0,20.0,354.0,,available,,1000.0,1000.0,Thùng 48 Hộp Sữa Bột Pha Sẵn Friso Gold Rtd Vani (48 x 180Ml),32539,Friso
435758,8002437276067,"Sữa Bột Abbott Grow 4 900g cung cấp nhiều GOS, Vitamin và khoáng chất giúp bé yêu hoàn thiện và phát triển hệ tiêu hóa, miễn dịch và tăng trưởng thể chất vượt trội. Sữa được nghiên cứu khoa học riêng ...",362000.0,378540.0,,16540.0,4.0,184.0,,available,,1000.0,1000.0,Sữa Bột Abbott Grow 4 cho trẻ từ 3 - 6 tuổi (900g),149739,Grow
129577440,1637113041912,"       Mô tả:   Dạng: Hạt gạo.   Màu sắc: Trắng đục.   Quy cách: Dạng bột, hạt gạo.   Đóng gói: Túi 1kg và 0,5kg.   Thương hiệu: R.O.C.   Xuất xứ: Việt Nam.   Thành ph...",70000.0,70000.0,,,,2.0,,available,,1000.0,1000.0,Bột Tẩy Rong Rêu Trên Nền Xi Măng ROC,111461,OEM
91205731,6564951070559,"Đồ chơi xếp hình, lắp ráp Qman 1411 - Tàu tuần dương biển (700 mảnh ghép)Bộ xếp hình Qman 1411 - Tàu tuần dương biển là sản phẩm thuộc series # COMBAT ZONES FIRE bộ sưu tập bán chạy của QMAN.Bộ sản ...",369000.0,459000.0,,90000.0,20.0,127.0,,available,,1000.0,1000.0,"Đồ chơi xếp hình, lắp ráp Qman 1411 - Tàu tuần dương biển (700 mảnh ghép)",317995,QMAN
102738895,6016410300147," Muối rửa bát Finish 1.2 KgMuối rửa bát finish 1.2kg được nhập khẩu từ Đức.Giúp ngăn chặn các tạp khoáng trong nước, không cho bám dính kết tủa trong máy rửa bát như các ion Ca+, mg+….Muối Rửa Finis...",390000.0,390000.0,,,,14.0,,available,,1000.0,1000.0,"Muối Rửa Bát Finish 1,2kg - Hàng Nhập Khẩu Đức",459929,finish
164337644,4618050053281,...,95000.0,95000.0,,,,10.0,,available,,1000.0,1000.0,Cháo sữa ăn dặm Burine vị Bích Quy - Nhập khẩu Đức dành cho trẻ từ 6 tháng tuổi (vỉ 6 hũ x 50g),26779,HiPP
52344942,3594358407668,"Khăn Giấy Rút Hiệu See-U (Indonesia)Xuất xứ: INDONESIAThành phần: 100% bột giấySố lượng: 4 gói, 2 Lớp, 200 Tờ/góiTính năng: Làm từ 100% bột giấy và không sử dụng hóa chất tẩy trắng, dập nổi góc, an...",66000.0,66000.0,,,,156.0,,available,,1000.0,1000.0,Combo 4 gói Khăn Giấy Rút See-U 2 Lớp 200 Tờ/gói,731357,See-U
94305944,5411662153969,SÁCH VẢI ĐUÔI PHÁT TRIỂN TRÍ THÔNG MINH CHO BÉ – CHỦ ĐỀ THẾ GIỚI KHỦNG LONG – BAO NGON TOYSDÒNG SÁCH VẢI ĐUÔI VỚI NHIỀU CHỦ ĐỀ:1. ĐẠI DƯƠNG SÂU THẲM2. THẾ GIỚI KHỦNG LONG A/B4. RỪNG XANH KỲ THÚ6....,89000.0,89000.0,,,,21.0,,available,,1000.0,1000.0,SÁCH VẢI ĐUÔI PHÁT TRIỂN TRÍ THÔNG MINH CHO BÉ – CHỦ ĐỀ THẾ GIỚI KHỦNG LONG ,111461,OEM
143503334,2384158649338,"       Cặp Balo chống gù lưng       Phần đệm lưng được thiết kế áp vào lưng không lộ, không làm bé khó chịu, thấm hút mồ hôi tốt, có đệm êm giúp giảm sức nặng của đồ trên vai cho trẻ, tránh chảy...",109000.0,109000.0,,,,,,available,,1000.0,1000.0,BA LÔ CHỐNG GÙ HÌNH GẤU CHO BÉ,111461,OEM
104140783,6330267059929,"*Đặc Biệt tinh dầu Jojoba có hiệu quả giữ ẩm cao, dễ dàng hấp thụ vào da. Chất giữ ẩm da có trong tinh dầu jojoba giúp hình thành lớp màng giữ ẩm, hạn chế sự mất nước và độ ẩm trên da dưới tác động mô...",65000.0,65000.0,,,,1.0,,available,,1000.0,1000.0,Tắm gội dịu nhẹ Pigeon Hương Jojoba 200ml/700ml (MẪU MỚI),26283,Pigeon
73638976,8256281757047,"- Siêu tẩy dầu mỡ HGO là sản phẩm thế hệ mới chuyên dùng làm sạch dầu mỡ đóng két lâu ngày trên màng lọc máy hút mùi, bếp ga, bếp từ, tường gạch ốp lát, thiết bị gia đình bị dầu mỡ đóng két khó làm sạ...",105000.0,105000.0,,,,10.0,,available,,1000.0,1000.0,"Tẩy dầu mỡ máy hút mùi, mặt bếp, tường gạch ốp, bồn rửa bát HGO 500ml",4275109,HGO
29540357,2366530978058,"Thông tin chi tiết: - Số mảnh ghép: 381 - Chi tiết đặc biệt: Màu sắc các miếng ghép đẹp, chất lượng an toàn cho bé, các mảnh ghép không sắc nhọn đỡ nguy hiểm cho bé. - Kích thước: 263 x 193 x 90 mm - ...",205000.0,229000.0,,24000.0,10.0,20.0,,available,,1000.0,1000.0,Đồ chơi lắp ghép xếp hình  Trực thăng chiến đấu 8 trong 1 Qman 1801,317995,QMAN
97008405,2636243926523,Combo 2 Hộp Chất Làm Sạch Lồng Giặt Mao Bảo - Tặng 1 hộp Chất tẩy rửa bình đun nước 25g x1 gói Giá sản phẩm trên Tiki đã bao gồm thuế theo luật hiện hành. Tuy nhiên tuỳ vào từng loại sản phẩ...,86000.0,100000.0,,14000.0,14.0,34.0,,available,,1000.0,1000.0,Combo 02 Hộp Vệ Sinh Lồng Máy Giặt Ag+ Mao Bao 306g - Tặng Chất Làm Sạch Bình Đun Nước 25g x 1 gói,46622,Mao Bao
104125144,9331814132115,"Đầu núm silicone mềm mại, vừa khít với khuôn miệng của béPhần đai rộng chứa nhiều không khíTy ngậm nhẹ nhất (so với các dòng Ty ngậm Pigeon)Độ tuổi: từ 12 tháng tuổi- Thông tin sản phẩmHDSD: Khi ...",103000.0,158000.0,,55000.0,35.0,7.0,,available,,1000.0,1000.0,Ty ngậm đôi Pigeon size L (HSD: 11/2025),26283,Pigeon
6464033,4425481039862,"Cháo Tươi Rau Củ Thập Cẩm Cây Thị được làm từ 100% nguyên liệu tươi ngon, tự nhiên được lựa chọn kỹ càng, sản xuất trên dây chuyền công nghệ hiện đại, và được kiểm soát chất lượng theo tiêu chuẩn quố...",22000.0,22000.0,,,,51.0,,available,,1000.0,1000.0,Cháo Tươi Rau Củ Thập Cẩm Cây Thị,211291,Cây Thị
184217978,2630827928010,"Nước Giặt Ariel Đậm Đặc Dạng Túi là sản phẩm được nhiều người ưa chuộng bởi tính năng đánh bay vết bẩn ngay từ lần giặt đầu tiên, làm trắng sáng vải, giúp vải mềm mịn và khử mùi ẩm mốc, lưu lại hương ...",195000.0,236500.0,,41500.0,18.0,119.0,,available,,1000.0,1000.0,Nước giặt Ariel chuyên gia cửa trên Sạch sâu hương nắng mai,46334,Ariel
189657651,7591144253219,"Nước giặt Lix Đậm Đặc Hương Hoa Túi 3.5Kg+ Khối lượng: 3.5Kg+ Dễ dàng loại bỏ các vết bẩn cứng đầuNước giặt Lix hương hoa dịu mát đậm đặc sẽ thấm sâu vào từng thớ vải, vừa giặt sạch dễ dàng hơn, vừ...",115000.0,115000.0,,,,68.0,,available,,1000.0,1000.0,Nước giặt Lix Đậm Đặc Hương Hoa Túi 3.5Kg - Tẩy Sạch Cực Mạnh Vết Bẩn - NG350,206763,Lix
43191091,3907956387070,"Thùng 48 Hộp Sữa Anlene Đậm Đặc 4X Ít Béo Hương Vani (12 x 4 x 125 ml) cung cấp các dưỡng chất như: chất đạm sữa chất lượng cao, có chứa các acid amin thiết yếu cho xương các khoáng chất như Canxi, Ph...",542000.0,552000.0,,10000.0,2.0,172.0,,available,,1000.0,1000.0,Thùng 48 Hộp Sữa Anlene Đậm Đặc 4X Ít Béo Hương Vani (12 x 4 x 125 ml),52347,Anlene
95035819,9135465993641,...,145000.0,145000.0,,,,175.0,,available,,1000.0,1000.0,Bột ăn dặm dinh dưỡng Sữa - Ăn dặm khởi đầu HiPP Organic 250g,26779,HiPP
412772,8101769082442,"Tã Quần Moony Bé Gái Gói Đại XL (38 Miếng) là sản phẩm cao cấp, được sản xuất theo công nghệ hiện đại nhất hiện nay, đáp ứng được tất cả những yêu cầu về chất lượng cũng như tiêu chuẩn về an toàn cho ...",284000.0,466400.0,,182400.0,39.0,318.0,,available,,1000.0,1000.0,Tã Quần Cao Cấp Moony Nhật Bản Bé Gái XL38 (38 Miếng),26809,Moony
109882431,4243074743889,"Đặc Điểm Cấu Tạo Bấm Móng Tay Sơ Sinh NUK Kích thước nhỏ gọn giúp cha mẹ dễ cầm nắm hay sử dụng.Thiết kế vòng cung phù hợp với độ cong móng tay, móng chân nhỏ nhắn của bé sơ sinh nhằm tránh làm ...",65000.0,69000.0,,4000.0,6.0,16.0,,available,,1000.0,1000.0,BẤM MÓNG TAY AN TOÀN CHO TRẺ SƠ SINH NUK DÙNG CHO BÉ TỪ 0 THÁNG TUỔI,26775,NUK
70659987,6130248128038,Máy xịt Hương tự động Glade đảm bảo cho không gian sống của bạn có hương thơm an toàn và tinh khiết. Trải nghiệm mùi hương nhẹ nhàng góp phần làm tăng cảm nhận tích cực về không gian sống cũng như gi...,282000.0,282000.0,,,,103.0,,available,,1000.0,1000.0,Máy Xịt Phòng Tự Động 60 Ngày Glade - Hương Biển Phiêu Bồng,110997,Glade
118946346,1521755907014,Hương: CamDung tích: 1LĐặc điểm “vượt trội” của sản phẩm nước rửa bát hữu cơ Golden Life là áp dụng công thức vi sinh trên tất cả sản phẩm với công nghệ hóa học tiên tiến của Châu Âu giúp dòng sản p...,29000.0,42000.0,,13000.0,31.0,4.0,,available,,1000.0,1000.0,Nước rửa chén bát hữu cơ Golden Life 1L - Hương Cam,699393,Golden Life
130209720,3570459776037,"Lốc 10 Gói Khăn giấy rút Minibear Nhật BảnĐặc biệt, loại giấy khô này được tạo nên từ chất liệu gỗ nguyên chất, không chứa Coliform và không chứa chất huỳnh quang, bảo mật và thích hợp với làn da nhạ...",96600.0,138000.0,,41400.0,30.0,71.0,,available,,1000.0,1000.0,"Lốc 10 Gói khăn giấy rút Minibear Nhật 300 tờ, chuyên dùng cho mẹ và bé.",111461,OEM
95269416,7991685123965,Bề mặt Naturesoft êm mềm từ sợi thiên nhiên – 100% nhập khẩu từ châu Âu.Bổ sung Vitamin E từ dầu mầm lúa mạch làm dịu và nuôi dưỡng làn da bé yêu.An toàn cho làn da nhạy cảm của bé không chứa các ...,319000.0,460000.0,,141000.0,31.0,242.0,,available,,1000.0,1000.0,Tã Dán Siêu Cao Cấp Huggies Platinum Naturemade M64 (64 Miếng),26702,Huggies
146499353,3122484868861,Bộ Bài Tây Poker Nền Đen Cao Cấp Chọn Màu – Bài Tây Đen Bằng Nhựa PVC Chống Thấm Nước Chống Gập Chính Hãng DododiosMô tả - Bộ Bài Tây Poker Nền Đen Cao Cấp - Chính Hãng Dododios Bộ Bài Tây Poker ...,29000.0,29000.0,,,,129.0,,available,,1000.0,1000.0,Bộ Bài Tây Poker Nền Đen Cao Cấp Chọn Màu – Bài Tây Đen Bằng Nhựa PVC Chống Thấm Nước Chống Gập Chính Hãng Dododios,5272071,dododios
43191092,8051974461207,"Thùng 48 Hộp Sữa Anlene Đậm Đặc 4X Ít Béo Hương Sô-Cô-La cung cấp các dưỡng chất như: chất đạm sữa chất lượng cao, có chứa các acid amin thiết yếu, các khoáng chất như Canxi, Phốt Pho, Magie, Kẽm, các...",522000.0,552000.0,,30000.0,5.0,125.0,,available,,1000.0,1000.0,Thùng 48 Hộp Sữa Anlene Đậm Đặc 4X Ít Béo Hương Sô-Cô-La (12 x 4 x 125 ml),52347,Anlene
214238333,2339702303422,"Combo Sữa Milo Nestle 1kg và Sữa Tươi Dạng Bột Nguyên Kem A2 Full Cream 1kg, Hàng Nội Địa Úc 1Kg, Giúp Bé Tăng Cân Nặng và Phát Triển Chiều Cao, Khỏe Mạnh, Tăng Cường Hệ Miễn Dịch va...",783000.0,1566000.0,,783000.0,50.0,16.0,,available,,1000.0,1000.0,"Sữa tăng chiều cao và tăng cân cho trẻ Milo Úc và A2 Full Cream High In Calcium Úc - Chống loãng xương ở người lớn, tăng sức khỏe tổng thể - Massel Official",33558,Nestlé
17459641,8709839097589,"Bộ xếp hình QMAN 2901 – HỘP GẠCH SÁNG TẠO CƠ BẢN• Sản phẩm không có mẫu cụ thể mà để bé có thể thỏa sức mình sáng tạo với số lượng 460 mảnh với nhiều mẫu gạch, đa dạng về kiểu dáng và màu sắc. Đặc bi...",169000.0,214000.0,,45000.0,21.0,11.0,,available,,1000.0,1000.0,Hộp xếp hình lắp ráp sáng tạo 460 chi tiết Qman 2901,317995,QMAN
194017033,5422978369898,"Chất liệu nhẹ, an toàn với béBalo 838 được Mr Vui lựa chọn kĩ càng về chất liệu. Phủ bên ngoài Mr Vui sử dụng chất liệu vải xốp 877 với bề mặt phủ chống nước, chống bám bụi, giữ hình ảnh và màu sắc ...",337000.0,398000.0,,61000.0,15.0,,,available,,1000.0,1000.0,Balo Tiểu Học Dành Bé Trai Mr Vui 838,231017,Mr.vui
58499716,4739686959451,"Nano bạc nguyên liệu nồng độ 1000ppm chai 500ml có thể pha được từ 20 lít nước để phun khử khuẩn, khử mùi cho nhà cửa, vật dụng, nhà xưởng, công ty, nuôi thú cưng,...Sản phẩm có mùi trà trắng nhẹ - k...",264000.0,440000.0,,176000.0,40.0,14.0,,available,,1000.0,1000.0,"Nano bạc 1000ppm đậm đặc chai 500ml pha với 20 lít nước dùng phun diệt khuẩn nhà cửa, văn phòng. Hương tinh dầu trà trắng dịu nhẹ",215437,AHT
62315154,3209354116628,"Hộp 12 viên diệt gián tận gốc Nhật Bản: * Thành phần: Hoạt chất Fipronil 0.05%* Kích thước: 21,1 x 3,1 x 15,1Hcm* Màu sắc: Nâu* Trọng lượng: 24g/viên* Công dụng: Đuổi & tiêu diệt các loại ...",97000.0,97000.0,,,,,,available,,1000.0,1000.0,Hộp 12 viên diệt gián tận gốc Nhật Bản,111461,OEM
120170788,3277558310902,"- Bột thông tắc cống, Toilet, Bồn rửa bát, chậu rửa mặt với công nghệ tiên tiến kết hợp các thành phần hoá học chuyên dụng tạo độ tẩy cực mạnh. Sản phẩm có khả năng đánh tan mọi chất cặn bẩn bám mắc l...",17900.0,17900.0,,,,3.0,,available,,1000.0,1000.0,"Bột thông tắc cống, Toilet, Bồn rửa bát, Chậu rửa mặt – Xử lý tắc nghẽn đường ống, bồn cầu cực mạnh – Khử mùi hôi GD002",111461,OEM
74973224,5316697559574,------XE ĐỊA HÌNH ĐIỀU KHIỂN TỪ XA TỐC ĐỘ CAO TỶ LỆ 1:16-------ƯU ĐIỂM :+ Chất liệu hợp kim chắc chắn ko chứa các chất phụ gia công nghiệp và hóa chất độc hại có chứng chỉ hợp quy của bộ Khoa học và c...,360000.0,360000.0,,,,299.0,,available,,1000.0,1000.0,"Đồ chơi xe địa hình điều khiển từ xa KAVY tỷ lệ 1:16 bằng hợp kim tốc độ cao, bền bỉ chắc chắn, dẫn động 2 bánh",4401601,KAVY
150385649,6840266506539,Đồ chơi khoa học kính hiển vi cầm tay chính hãng TOPBRIGHTĐồ chơi khoa học kính hiển vi cầm tay – TopbrightKích thước hộp: 16.6 x 24.5 x 6.3cmKhối lượng: 0.3kgĐộ tuổi thích hợp: 8+ (Level 3 – Scie...,355000.0,499000.0,,144000.0,29.0,47.0,,available,,1000.0,1000.0,Đồ chơi khoa học kính hiển vi cầm tay chính hãng TOPBRIGHT,5156931,Topbright
25026925,4786629748412,"Tã Quần Người Lớn SunMate Khô Thoáng M8 Tã Quần Người Lớn SunMate Khô Thoáng M8 phù hợp với người có thể đi lại, và cần độ thấm hút cao. Tã Quần Người Lớn SunMate Khô Thoáng phù hợp với người có th...",160000.0,199999.0,,39999.0,20.0,121.0,,available,,1000.0,1000.0,Combo 2 Gói Tã Quần Người Lớn Sunmate Khô Thoáng M8 (8 Miếng/ Gói),48647,SunMate
54477959,3118466765917,VIDEO REVIEW SẢN PHẨM Lái xe mô phỏng Có đèn nhấp nháy & hiệu ứng âm thanhVô lăng có thể xoay 360 độ xoay phải xoay trái như thật.Sản phẩm đang cực kỳ HOT mama và papa nhanh mua về cho bé đi...,219000.0,300000.0,,81000.0,27.0,165.0,,available,,1000.0,1000.0,Đồ chơi trẻ em bằng nhựa ABS Vô Lăng Tập Lái Cho Bé Có 2 màu cho bé trai và gái,745233,RongDali Toys
164075691,9099442899524," Kitin Natural - ""Chiếc áo giáp"" bảo vệ làn da con với sức mạnh bảo vệ từ thiên nhiên Tiên phong trong dòng sản phẩm phân khúc bình dân, tã bỉm Kitin Natural với đột phá tinh chất trà xanh thiên nhiê...",225000.0,225000.0,,,,57.0,,available,,1000.0,1000.0,Tả quần Kitin Natural size L40 (9-14kg),5365729,Kitin Natural
103881069,6735941844629,"Là sản phẩm tiện ích giúp các bậc phụ huynh an tâm hơn trong việc bảo vệ và chăm sóc bé yên khỏi những va đập, trầy xước hằng ngày.Chất liệu silicon cực kỳ mềm mại dai khó rách, bảo vệ bé an toàn khỏi...",44100.0,44100.0,,,,53.0,,available,,1000.0,1000.0,Miếng Bịt Góc Bàn Ghế Hình Chân Mèo,111461,OEM
196757806,9055559061161,"Set 2 Miếng Silicon Bọc Góc Bàn, Góc Tủ, Cạnh Giường Giữ An Toàn Cho BéĐóng gói: 2 miếng bịt góc bàn.️ Tính năngMiếng bọc cạnh bàn, cạnh giường tủ giúp bảo vệ bé khỏi các va chạm nguy hiểm.Chất liệu...",39000.0,39000.0,,,,45.0,,available,,1000.0,1000.0,"Set 2 Miếng Silicon Bọc Góc Bàn, Góc Tủ, Cạnh Giường Giữ An Toàn Cho Bé",5706641,NAVIVU
67729762,9805360816749,"Sữa tắm gội toàn thân Cetaphil Baby Gentle Wash & Shampoo 2 in 1 chứa thành phần Calendula hữu cơ chiết xuất từ hoa cúc vạn thọ chống kích ứng, sát khuẩn, chống viêm và làm lành da, chống lại các ...",221000.0,226000.0,,5000.0,2.0,97.0,,available,,1000.0,1000.0,Sữa tắm gội toàn thân Cetaphil Baby Gentle Wash & Shampoo 2 in 1 400ml,149699,Cetaphil
10021552,4248658220463,"Sữa mẹ là tốt nhất cho sự phát triển của trẻ  và trẻ nhỏ, tuy nhiên trong những trường hợp mẹ bị thiếu sữa thì bé sẽ cần cung cấp nguồn sữa bên ngoài để đảm bảo cho bé sự phát triển tốt nhất.  Infant ...",559000.0,559000.0,,,,1.0,,available,,1000.0,1000.0,Sữa Bột Meiji 0-1 Infant Formula (800g),144936,Meiji
188126560,3012066021382,"VIÊN TẨY BỒN CẦU VIM POWER 5 HƯƠNG TRÀ XANH CHANH VÀNG - SẠCH KHUẨN, THƠM MÁT SUỐT 30 NGÀYĐột phá mới - Viên Tẩy Bồn Cầu Vim Power 5 Hương Trà Xanh Chanh Vàng MỚI là giải pháp tiện lợi, giúp bồn cầu ...",75000.0,84000.0,,9000.0,11.0,41.0,,available,,1000.0,1000.0,Combo 3 Viên Tẩy Bồn Cầu VIM Power 5 Hương Trà Xanh Chanh Vàng 55G,45938,Vim
