id,sku,short_description,price,list_price,price_usd,discount,discount_rate,review_count,order_count,inventory_status,is_visible,stock_item_qty,stock_item_max_sale_qty,product_name,brand_id,brand_name
151605868,3376518480498,Genius cho ra mắt sản phẩm chuột không dây chống ồn.Chuột không dây NX-8000S với thiết kế nút bấm giúp giảm thiểu tối đa tiếng ồn khi nhấp chuột. Bạn không còn phải lo lắng bị làm phiền bởi tiếng ồn...,159000.0,209000.0,,50000.0,24.0,7.0,,available,,1000.0,1000.0,Chuột Không Dây Chống Ồn Genius NX-8000S - Hàng Chính Hãng ,19071,Genius
71505389,9602917932576,"GIỚI THIỆU SẢN PHẨMĐồng hồ Điện thoại Trẻ emAMA WATCH G2 7GameCài đặt không cần ứng dụng- Nếu Cha mẹ tìm mua Đồng hồ Thông minh cho con nhưng lại không biết thêm danh bạ, không biết chỉnh giờ, kh...",570000.0,570000.0,,,,240.0,,available,,1000.0,1000.0,"Đồng hồ Điện thoại có 7 GAME Giải trí, Hỗ trợ Thẻ nhớ 32G Music, lắp Sim không cần Đăng ký 4G, Thêm danh bạ dễ dàng không cần ứng dụng - Hàng nhập khẩu",2630119,AMA
536965,6503600761257,"Kiểu dáng thời trang Tai Nghe Logitech H111 được thiết kế thời trang, kiểu chụp đầu ôm sát tại nhưng rất gọn nhẹ tạo được cảm giác thoải mái và êm ái cho người dùng. Bạn có thể mang theo sử dụng bất ...",178000.0,178000.0,,,,61.0,,available,,1000.0,1000.0,Tai nghe chụp tai Logitech H111 - Hàng chính hãng,18984,Logitech
118722616,5152430152751,"CHUỘT QUANG USB B100 DÀNH CHO DOANH NGHIỆP CHUỘT QUANG USB B100Thoải mái. Bền bỉ. Thiết yếu <div id=""section_2012518749_c-ia93737ca021e9504331183384e6def9e"" class=""pangea-cm...",65000.0,65000.0,,,,26.0,,available,,1000.0,1000.0,Chuột có dây LOGITECH B100 - Hàng chính hãng,18984,Logitech
136818264,8807897307171,...,99000.0,150000.0,,51000.0,34.0,180.0,,available,,1000.0,1000.0,Ốp lưng kéo nắp kiểu mới dành cho iPhone 11 / 12 / 13 / 14 / 11 Pro / 12 Pro / 13 Pro / 14 Pro / 11 Pro Max / 12 Pro Max / 13 Pro Max / 14 Pro Max / 12 Mini / 13 Mini / 14 Plus - Hàng chính hãng,625265,Photodesign VN
80932325,7866333842798,"       KỆ DÁN TƯỜNG ĐỂ ĐIỆN THOẠI KIÊM GIÁ ĐỠ SẠC   TIỆN LỢI VÀ CHẮC CHẮN NHA KHÁCH IU   - Kích thước: 8,6 x 9,9cm   - Chất liệu: Nhựa PP cao cấp.   - Kệ để remote kèm móc treo sạc điện th...",17900.0,17900.0,,,,16.0,,available,,1000.0,1000.0,Kệ Dán Tường Để Remote - Giá Đỡ Sạc Điện Thoại Có Móc Treo Giữ Dây Điện,111461,OEM
71656427,6843000655139,...,8999.0,17998.0,,8999.0,50.0,17.0,,available,,1000.0,1000.0,Ốp Lưng Dẻo TPU Trong Suốt Dành Cho Iphone 12/ 12 Pro/ 12Promax/ SE 2020/ iPhone11/ 11Pro/ 11Promax/ X / XS/ XS Max / XR / 7 8 Plus. Hàng Chính Hãng Helios,205535,Helios
55850715,9748572559267,"Có thể tháo rời, dễ dàng cài đặt.Chất liệu hợp kim nhôm, độ bền cao, chống ăn mòn, và rất dễ dàng để làm sạch.An toàn và chắc chắn: các cạnh phía trước nâng lên giữ máy tính xách tay trong khi ở vị tr...",369000.0,369000.0,,,,24.0,,available,,1000.0,1000.0,Giá đỡ laptop stand nhôm cho máy tính xách tay,111461,OEM
584798,3177121639116,Webcam Logitech C922 Optimized For Streaming (New) Webcam Logitech C922 Optimized For Streaming (New) là phiên bản hiện đại được nâng cấp từ người tiền nhiệm C920. Chiếc Webcam C922 này thể quay phim...,2690000.0,2690000.0,,,,1.0,,available,,1000.0,1000.0,"Webcam Logitech C922 Full HD 1080p - 720p/60FPS micro kép to rõ, tự động lấy nét và chỉnh sáng HD, phù hợp PC/ Laptop/ Mac - Hàng chính hãng",18984,Logitech
127236876,3502187216207,"       【Thông số kỹ thuật】    Tên sản phẩm:Giá đỡ Laptop, Macbook, Ipad gấp gọn bằng nhôm, Kệ đỡ laptop 13.3-14-15.6 inch có thể chỉnh độ cao, hỗ trợ tản nhiệt    Màu sắc: Bạc / Xám / Đen   【Lợ...",69000.0,69000.0,,,,6.0,,available,,1000.0,1000.0,"Giá đỡ Laptop, Macbook, Ipad gấp gọn bằng nhôm, Kệ đỡ laptop 13.3-14-15.6 inch có thể chỉnh độ cao, hỗ trợ tản nhiệt",111461,OEM
177613972,4773841396640,Mô tả sản phẩmThông tin kỹ thuậtPin tốtGO Air POP có thời gian chơi hơn 8 giờ trong mỗi tai nghe và thêm 24 giờ kể từ hộp sạc (tổng cộng hơn 32 giờ). Quay lại hộp đựng để sạc lại chồi và s...,490000.0,890000.0,,400000.0,45.0,37.0,,available,,1000.0,1000.0,Tai nghe Bluetooth TWS không dây Jlab Go Air Pop thời gian nghe 32H EQ3 Sound chuẩn IPX4 chống ồn tích hợp dây sạc - Hàng chính hãng BH đổi mới 2 năm,4502107,Jlab
21857291,6216595667021,"Giới thiệu sản phẩm USB-C / M sang HDMI / USB3.0A / F + SD / F + T / F là cáp mở rộng truyền video, thiết bị đầu vào có giao diện USB-C cho điện thoại di động, máy tính bảng, máy tính xách tay, , USB-...",272900.0,272900.0,,,,118.0,,available,,1000.0,1000.0,Hub chia USB Type-C 5 Cổng HDMI/USB 3.0/SD/TF,111461,OEM
188318615,7196589581312,"Bảo vệ tai nghe khỏi bụi bẩn, trầy xước, hao mòn hiệu quảCầm không trơn tayCó thể rửa sạch bằng nướcThiết kế đơn giản, nhỏ gọn và vừa đủ mỏng để vẫn vừa vặn trong túi bạn và dễ dàng mang theo.Lưu ...",99000.0,99000.0,,,,7.0,,available,,1000.0,1000.0,Case Ốp Bảo Vệ Gấu Nice dành cho Tai Nghe AIRPODS 3/Airpods Pro/Airpods 1/2 Kèm Khóa treo hình- Hàng chính hãng,4973949,Kai Nguyễn
134656521,9678469750135,Tốc độ truyền tải lớn với giao tiếp USB 3.0USB OTG SanDisk Ultra 16GB Dual Drive m3.0 được trang bị cổng kết nối USB 3.0 giúp truyền tải dữ liệu với tốc độ nhanh gấp nhiều lần so với cổng 2.0. Nhờ vậ...,100000.0,100000.0,,,,2.0,,available,,1000.0,1000.0,USB OTG SanDisk Ultra Dual Drive m3.0 - Hàng Chính Hãng,18845,SanDisk
56033,5003358053341,"Thiết kế nhỏ gọn Chuột Không Dây Logitech M187 kết nối không dây 2.4GHz, kích thước nhỏ gọn thoải mái với tay cầm và bạn có thể dễ dàng mang theo bên mình để sử dụng. Thiết bị nhận phát sóng nano, kế...",265000.0,265000.0,,,,2.0,,available,,1000.0,1000.0,Chuột Không Dây Logitech M187 - Hàng chính hãng,18984,Logitech
184132996,4661011978760,Chi Tiết Sản Phẩm Cốc Sạc Đa Năng 3 Cổng Sạc Baseus Compact Charger 17W- Cốc Sạc Đa Năng 3 Cổng Sạc Baseus Compact Charger 17W được trang bị 3 Port USB (Type A) cho phép bạn có thể kết nối và sạc pin...,195000.0,259000.0,,64000.0,25.0,12.0,,available,,1000.0,1000.0,Cốc Sạc Đa Năng 3 Cổng Sạc Baseus Compact Charger 17W - Hàng chính hãng,21651,Baseus
35277311,4464094421497,"Thiết kế đơn giản. chắc khỏe, giữ chắc điện thoại bằng 3 chân kẹp tự độngGiúp cho điện thoại cố định không hề rung lắc kh di chuyển với tốc độ caoDể dàn tháo điện thoại ra khỏi giá đỡXoay 360 độ ti...",150000.0,150000.0,,,,16.0,,available,,1000.0,1000.0,Giá Đỡ Điện Thoại Thông Minh Hoco CAD01 - Hàng Chính Hãng ,21653,Hoco
216406375,8413294737050,"Khả năng tương thích:Bút cảm ứng hỗ trợ cho dòng iPad (2018-2021), iPad thế hệ thứ 9/8/7/6, iPad Air thế hệ thứ 3/4, iPad Pro 11 inch, iPad Pro12.9 inch 3rd/4th/5th,iPad mini 5th/6th gen.Không cần ghé...",890000.0,890000.0,,,,79.0,,available,,1000.0,1000.0,"Bút cảm ứng ESR Digital iPad Stylus Pencil dành cho iPad Pro/ Ipad Air/ Ipad Mini/ Ipad Gen 6,7,8,9 - Hàng chính hãng",189445,ESR
135284107,8918158075067,"Ưu điểm của shop:- Shop mall, bên mình là nhà phân phối chính thức của hãng Rockspace- Sản phẩm Headphone, tai nghe chụp tai bluetooth Rockspace O2 giống y hình và mô tả, nếu không giống shop sẽ hoà...",465000.0,595000.0,,130000.0,22.0,180.0,,available,,1000.0,1000.0,Headphone Tai Nghe Chụp Tai bluetooth Rockspace O2 kết nối không dây có mic nghe nhạc liên tục 15h - Hàng chính hãng ,146202,ROCK SPACE
164266659,6898320780295,Tai nghe bluetooth True Wireless không dây hàng chính hãng1. PHIÊN BẢN F9:   * Thông số kĩ thuật:- Bluetooth: 5.1- Khoảng cách kết nối: khoảng 10m- Trọng lượng 2 tai nghe: 50g- Kích thước: 21...,65000.0,94900.0,,29900.0,32.0,21.0,,available,,1000.0,1000.0,"Tai nghe bluetooth không dây nhét tai True Wireless thể thao pin trâu kết nối nhanh, ổn định kèm mic hỗ trợ đàm thoại, chống ồn tốt tương thích với điện thoại, laptop, máy tính 5Tech hàng chính hãng",5055635,5Tech
179444874,4481539931056,ỐP LƯNG CHỐNG SỐC DÀNH CHO IPHONE 11 / 12 / 13 / 11 PRO / 12 PRO / 13 PRO / 11 PRO MAX / 12 PRO MAX / 13 PRO MAX / 12 MINI / 13 MINI - HÀNG CHÍNH HÃNG...,79000.0,150000.0,,71000.0,47.0,51.0,,available,,1000.0,1000.0,Ốp lưng chống sốc dành cho iPhone 11 / 12 / 13 / 11 Pro / 12 Pro / 13 Pro / 11 Pro Max / 12 Pro Max / 13 Pro Max / 12 Mini / 13 Mini - Hàng chính hãng,625265,Photodesign VN
74890302,5315883532070, ỐP LƯNG DA CHỐNG SỐC DÀNH CHO IPHONE 7 / 8 / SE 2020 / 7 PLUS / 8 PLUS / X / XS / XS MAX / XR / 11 / 11 PRO / 11PRO MAX / 12 / 12 MINI / 12 PRO / 12 PRO MAX ...,119000.0,199000.0,,80000.0,40.0,317.0,,available,,1000.0,1000.0,Ốp lưng da chống sốc dành cho iPhone 7 / 8 / SE 2020 / 7 PLUS / 8 PLUS / X / XS / XS MAX / XR / 11 / 11 PRO / 11 PRO MAX / 12 MINI / 12 / 12Pro / 12 Pro Max - Hàng chính hãng,625265,Photodesign VN
554912,6704175027186,Logitech vừa tung ra thị trường Việt Nam một sản phẩm mang tên Logitech G102 Gen 2 Lightsync.Chuột Logitech G102 Gen 2 LightsyncLogitech G102 Gen 2 Lightsync được thiết kế nút sáu cổ điển cung cấp ...,390000.0,399000.0,,9000.0,2.0,187.0,,available,,1000.0,1000.0,Chuột Chơi Game Có Dây Logitech G102 8000DPI RGB 6 Phím - Hàng Chính Hãng,18984,Logitech
49498981,5896566138517,"- Chất liệu dây dù- Độ ổn định cao, Khả năng lọc và chống ồn cao- Giúp bạn nghe nhạc hoặc đàm thoại cực tốt- Dùng tốt cho các đời Samsung Galaxy S5; S6; S7, s8, s9 / Note 4; 5 và tất cả dòng điện tho...",139000.0,139000.0,,,,156.0,,available,,1000.0,1000.0,Tai nghe dành cho Samsung Galaxy S10/S10 Plus,111461,OEM
50424465,5358307096765,"Lý do bạn nên mua sản phẩm này!- Sản xuất riêng cho các dòng iPad- Chất liệu PET siêu mỏng, bám dính tốt- Dễ dán và dễ gỡ bỏ- Chống vån tay, chống chói, độ trong suốt cao- Dán màn hình iPad chuyên dụn...",162272.0,162272.0,,,,3.0,,available,,1000.0,1000.0,Dán màn hình dành cho iPad Paper-like chống vân tay cho cảm giác vẽ như trên giấy,111461,OEM
29238111,7502750940566,"Tai Nghe Bluetooth True Wireless TaoTronics SoundLiberty 53 (TT-BH053) cảm nhận sự tự do của không dây với tai nghe không dây thực sự của TaoTronic.Được thiết kế để đeo thoải mái, lâu dài với cấu trú...",499000.0,950000.0,,451000.0,47.0,16.0,,available,,1000.0,1000.0,Tai Nghe Bluetooth True Wireless TaoTronics SoundLiberty 53 (TT-BH053) - Hàng Chính Hãng,245385,TaoTronics
75582647,4517224713945,  Bộ Cốc sạc và Cáp sạc nhanh Baseus Super Si PD 20W CCCJGCC for iPhone 12 Thông số:Thương hiệu: BASEUSGaN: khôngCông suất đầu ra tối đa: 20wXuất xứ: Trung Quốc (Xuất xứ)Giao diện đầu ra: Typ...,216000.0,216000.0,,,,142.0,,available,,1000.0,1000.0,Bộ Cốc sạc và Cáp sạc nhanh Baseus Super Si PD 20W CCCJGCC for iPhone 12 (Hàng chính hãng),21651,Baseus
54665,5006348510336,"*Hình ảnh sản phẩm và logo sẽ thay đổi tùy theo đợt nhập hàngPlug-and-play đơn giảnChuột Không Dây Logitech M185 với đầu thu Nano nhỏ gọn, bạn có thể kích hoạt và sử dụng chuột một cách nhanh chóng ...",298000.0,298000.0,,,,1.0,,available,,1000.0,1000.0,Chuột không dây Logitech M185 - Hãng chính hãng,18984,Logitech
109455098,7869578064782,Cáp sạc nhanh PD20W truyền dữ liệu Baseus Metal Data Type-C sang iPhone ( 2 size ) - Hàng chính hãng Sạc nhanh : PD 20WTốc độ truyền dữ liệu cao : 480MbpsCổng sạc : Type-C to iPhoneTương ...,139000.0,139000.0,,,,45.0,,available,,1000.0,1000.0,Cáp sạc nhanh PD20W truyền dữ liệu Baseus Metal Data Type-C sang iPhone ( 2 size ) - Hàng chính hãng,21651,Baseus
56264868,7967157269809,"VIDEO SẠC CHO XSMAX, KHÔNG LOẠN CẢM ỨNG, NHẬN ĐỦ 18W, ĐÚNG CÔNG NGHỆ PD3 CỦA IPHONECông nghệ sạc nhanh mới  nghiên cứu có tên gọi là “Super fast charging 25W” – “Sạc siêu nhanh 25W” chuẩn Power Deli...",149000.0,149000.0,,,,6.0,,available,,1000.0,1000.0,"Bộ Adapter S20, Note 10 25W sạc siêu nhanh + cable USB-C dành cho điện thoại Samsung S10, S20, Ipad, Iphone (Tặng kèm que chọt sim) có ảnh thật kèm theo",111461,OEM
108202304,3156552733251,"- Chip thông minh an toàn và ổn định, tự động nhận diện nguồn sạc của các thiết bị khác nhau, phù hợp với dòng sạc.- Hỗ trợ sạc với hầu hết các thiết bị trên thị trường- Sạc nhanh 20w nhanh chóng ...",239000.0,239000.0,,,,24.0,,available,,1000.0,1000.0,Củ sạc nhanh chuẩn kép PD+QC 20W Remax RP-U64 - Hàng chính hãng,111454,Remax
4365045,6964430050223,"Dây cáp 2 đầu HDMI Full HD 1,5m (Đen) Với xu thế thời thượng mọi gia đình đều ưu chuộng những thiết bị công nghệ số bậc cao đồng nghĩa với việc phải sử dụng nhiều loại dây cáp kết nối giữa các cổng k...",63000.0,63000.0,,,,239.0,,available,,1000.0,1000.0,"Dây HDMI 1,5M Tròn",111461,OEM
192376330,3309195559719,"Vỏ Ốp silicon bọc bút dành cho Apple Pencil 2 Mèo Carton100% hàng mới, chất lượng cao.Chỉ phù hợp cho iPad Pencil 2Làm bằng chất liệu silicon, mềm và bền, dễ gắn và sử dụng.Vỏ silicon này cũng có ...",95000.0,95000.0,,,,8.0,,available,,1000.0,1000.0,Vỏ Ốp silicon bọc bút dành cho Apple Pencil 2 Hình Mèo Carton- Hàng chính hãng,4973949,Kai Nguyễn
107457318,8263695270635,"Thiết bị chuyển đổi HDMI Earldom W18 hỗ trợ chuyển đổi từ cổng USB TypeC 6 in 1(USB TypeC 6 to HDMI + 3 USB 3.0 + SD Card Reader + TF Card Earldom W18), Dành Cho Macbook, Samsung, Huawei, Xiaomi - hà...",329000.0,629000.0,,300000.0,48.0,23.0,,available,,1000.0,1000.0,Thiết bị Earldom W18 hỗ trợ chuyển đổi từ cổng USB TypeC 6 in 1(USB TypeC 6 to HDMI + 3 USB 3.0 + SD Card Reader + TF Card Earldom W18) - hàng chính hãng,111458,Earldom
4497075,7882038833255,"Truyền dữ liệu tốt, sạc nhanh Tương thích tốt với các dòng điện thoại xài giao tiếp USB Type C Tương thích với hầu hết các chuẩn sạc nhanh hiện nay: Quick charge Dùng với cốc sạc zin sẽ rút ngắn...",39000.0,39000.0,,,,32.0,,available,,1000.0,1000.0,Cáp sạc Type C có hỗ trợ sạc nhanh lõi đồng,111461,OEM
141502002,1583585776725," Nội dung ưu đãi sim MDT350: Mỗi tháng 4Gb tốc độ cao dùng trong 1 năm, hết dừng kết nối ạ, mọi người lưu ý trước khi đặt sim nhé!Nhận sim mới kích hoạt, nếu KH cần lên gói luôn nhắn tin cho shop nhé...",299000.0,299000.0,,,,23.0,,available,,1000.0,1000.0,[Xả Kho]Sim 4G mobifone  sim mạng 1 năm không phải nạp tiền,26675,Mobifone
77754757,1067176009226,"Chất liệu nhựa silicone với hình chó Shiba đáng yêu kèm móc RingCầm chắc tay, mỏng nhẹ, hình ảnh sắc nétBảo vệ máy tránh trầy xước, rạn nứt, móp méo khi va đập, rơi rớt,…Nút bấm, camera, cổng kết nối,...",71900.0,71900.0,,,,1.0,,available,,1000.0,1000.0,Ốp lưng Silicon cho iPhone 12 Mini / 12 / 12 Pro / 12 Pro Max Chó Shiba Kèm Móc Ring,111461,OEM
29575776,5573448433440,"CÁP NỐI DÀI USB :- Nối dài cổng USB rất tiện lợi- Chiều dài cáp : 1.5m- Sản xuất trên công nghệ tiên tiến, chống nhiễu siêu tốt đảm bảo tín hiều được truyền ổn định…...",22900.0,22900.0,,,,37.0,,available,,1000.0,1000.0,Dây Cáp USB 2 Đầu Dương 1.5m ( Đen ),111461,OEM
83749783,6387378732349,"Mặt trước chất liệu da tổng hợp cao cấpMặt sau TPU dẻo tháo lắp dễ dàngBảo vệ an toàn cho thiết bị, ngăn chặn trầy xước hay nứt vỡBật / tắt thiết bị khi đóng / mở bao da tiện lợiPhù hợp với Máy Tính B...",129000.0,129000.0,,,,1.0,,available,,1000.0,1000.0,Bao Da Cover Dành Cho Máy Tính Bảng Huawei MatePad T10s 10.1 Inch AGS3-L09 / AGS3-W09 Hỗ Trợ Smart Cover,111461,OEM
190824210,6295662426245,"Thiết kế gọn nhẹ, có thể gập gọn khi di chuyển Các đầu tiếp xúc được gắn silicon êm mềm, không gây trầy xước máy Tương thích với hầu hết mọi /Laptop Chất liệu hợp kim nhôm độ bền cao Tạo độ nghiêng gi...",147760.0,184700.0,,36940.0,20.0,2.0,,available,,1000.0,1000.0,"Giá Đỡ Máy Tính, Laptop, Hợp Kim Nhôm Cao Cấp. Hỗ Trợ Tản Nhiệt Chống Mỏi Cổ, Vai, Gáy",111461,OEM
105829753,9486823955958, ...,175000.0,189000.0,,14000.0,7.0,,,available,,1000.0,1000.0,"(Tặng túi đựng TOPK) Củ sạc nhanh Baseus mini 20W, hai cổng sạc USB và Type-C sạc nhanh cho iPhone, Samsung, Xiaomi, Huawei,...-Hàng chính hãng",21651,Baseus
46107481,1809358006196,"Loa BluetoothCharge Mini 3+Âm Thanh Cực Chuẩn Hay–Hỗ trợ kết nối Bluetooth với các thiết bị di động để phát nhạc, có thể điều khiên chuyển bài hoặc tắt thiết bị ngay trên các nút cơ của sản phẩm, ma...",139000.0,139000.0,,,,243.0,,available,,1000.0,1000.0,LOA BLUETOOTH CHARGE MINI 3+ G01 - PIN TRÂU 6000MAH - HÀNG NHẬP KHẨU,618755,G01
152011359,4303100861956,CHÀO MỪNG QUÝ KHÁCH ĐẾN VỚI GIAN HÀNG CỦA BUBUCASE!CÁC TÍNH  NĂNG CỦA BAO DA DÀNH CHO IPAD CAO CẤP BUBUCASE:1. Chất liệu cao cấp - Bảo vệ tối đaMặt trước: Được chế tạo từ chất liệu da tổng hợp cao...,144000.0,144000.0,,,,1.0,,available,,1000.0,1000.0,Bao Da Case Cover Dành Cho iPad Full Dòng Mini 1/2/3/4/5/6 - Air 1/2/3/4 - Gen 5/6/7/8/9 - Pro 11 Inch 2018/2020 - Pro 12.9 Inch,111461,OEM
196946349,3572122343324,"- Đây là dòng Frosted Shield PRO khác hoàn toàn so với các dòng trước đây, hãng Nillkin đã cập nhật lại thiết kế thay vì ốp full nhựa cứng thì nay thiết kế mặt lưng Nhựa PC như truyền thốn dòng Froste...",199000.0,199000.0,,,,2.0,,available,,1000.0,1000.0,Ốp Lưng dành cho iPhone 14 / 14 Plus / 14 Pro / 14 ProMax Nillkin S.Frosted Shield Pro- Hàng chính hãng,149308,Nillkin
1570185,2532525726274,"Thiết kế mỏng, kiểu dáng đẹpBảng Vẽ Wacom Intuos Pro Medium PTH-660 chế tạo bằng vật liệu cao cấp và được thiết kế để tận dụng tối đa sức mạnh tuyệt vời của bút Wacom Pro Pen 2, Intuos Pro là dòng b...",8890000.0,8890000.0,,,,2.0,,available,,1000.0,1000.0,Bảng Vẽ Wacom Intuos Pro Medium PTH-660 - Hàng Chính Hãng,156529,Wacom
73837518,1225710661948,Tai Nghe Không Dây True Wireless Nhét Tai – Hàng Chính HãngThông số kỹ thuật:Công nghệ chống thấm nước: IPX5Phạm vi kết nối: khoảng 10mThời gian sử dụng: 1-4 giờDung lượng hộp sạc: 1200mAhThời ...,250000.0,500000.0,,250000.0,50.0,59.0,,available,,1000.0,1000.0,Tai Nghe Không Dây True Wireless Nhét Tai – Hàng Chính Hãng,500047,PKCB
20106816,2926382800893,"Hình Chữ Nhật,dày 2mm, kích thước 30 x 80 cmChất liệu mềm mại, chống trơn trượtMàu sắc tươi tắn, hình ảnh dễ thương góp phần tô điểm hơn cho bàn làm việc của bạn...",95000.0,95000.0,,,,4.0,,available,,1000.0,1000.0,Miếng Lót Chuột Size Lớn Dễ Thương ( 30 x 80 cm),111461,OEM
109983015,6591903843713," Giới thiệu sản phẩmCáp sạc IP Baseus Superior Series Fast Charging Data Cable cho iPhone/ iPad (2.4A, 480Mbps, Fast charge, ABS/ TPE Cable)- Là dòng sản phẩm cáp sạc USB to IP tiêu chuẩn dành cho i...",125000.0,149000.0,,24000.0,16.0,6.0,,available,,1000.0,1000.0,"Cáp sạc iPhone Baseus Superior Series Fast Charging Data Cable (2.4A, 480Mbps, Fast charge, ABS/ TPE Cable) -  Hàng Chính Hãng ",21651,Baseus
197387432,5303379728834,"Năm 2022, Mipow với tham vọng định hình và phát triển mảng ốp lưng cho iPhone trên toàn cầu.Họ đã cải tiến chất lượng đột phá hoàn toàn, Mipow sẵn sàng chi tiêu với chi phí khá cao để ứng dụng nguyên...",228000.0,240000.0,,12000.0,5.0,3.0,,available,,1000.0,1000.0,"Ốp Lưng MIPOW SOFT TPU CRYSTAL CLEAR Nguyên Liệu Đức (DROPTEST 1.8M, Chống Ố Vàng) dành cho iPhone 14 / iPhone 14 Plus/ iPhone 14 Pro/ iPhone 14 ProMax- Hàng chính hãng",156929,MIPOW
25775437,4649417961922,"Mặt sau TPU dẻo tháo lắp dễ dàngBảo vệ an toàn cho thiết bị, ngăn chặn trầy xước hay nứt vỡBật / tắt thiết bị khi đóng / mở bao da tiện lợiPhù hợp với Máy Tính Bảng Huawei MediaPad T3 10 (2017)...",129000.0,129000.0,,,,1.0,,available,,1000.0,1000.0,Bao Da Cover Cho Máy Tính Bảng Huawei MediaPad T3 10 (2017) Hỗ Trợ Smart Cover,111461,OEM
57511280,2892925830163,"Loại giá đỡ: Gắn sau ghế xe hơiChất Liệu: Nhựa + silicon + hợp kimĐộ dài: 140-180mmDùng được cho: điện thoại hoặc máy tính bảng 4,7-12.9 inchChỉ cần kẹp 2 đầu giá đỡ vào 2 thanh kim loại phía sau ...",143928.0,199900.0,,55972.0,28.0,2.0,,available,,1000.0,1000.0,"Giá đỡ cho điện thoại máy tính bảng lắp sau ghế dùng cho ô tô xe hơi(xoay 360 độ, tiện dụng, phù hợp nhiều dòng xe)",111461,OEM
157425215,2326435351887,"       Hub usb chia từ 1 cổng usb thành 4 cổng usb tốc độ cao   Thiết kế đẹp, có đèn led phong cách   Giờ đây mọi kết nối với các thiết bị ngoại vi đẹp hơn bao giờ hết.   Kết nối ổn định.   Hu...",45000.0,45000.0,,,,3.0,,available,,1000.0,1000.0,Bộ chia USB từ 1 thành 4 cổng usb tốc độ 480mbps,111461,OEM
107212953,2584769080730,"       Giá Đỡ Máy Tính Bảng Ipad Stand 201 Đa Năng Điều Chỉnh Độ Cao Dành Cho Điện Thoại, Ipad   - Thu gọn và tháo lắp dễ dàng   - Đa năng dễ sử dụng trên mọi lứa tuổi và vị trí năm hay ngồi xem...",286598.0,530000.0,,243402.0,46.0,,,available,,1000.0,1000.0,"Giá Đỡ Máy Tính Bảng Ipad Stand 201 Đa Năng Điều Chỉnh Độ Cao Dành Cho Điện Thoại, Ipad",111461,OEM
190703469,2965575802614,"Mặt ngoài túi là vải chống thấm vân sọc đẹp mắt, mặt trong lót nỉ chống sốc bảo vệ hiệu quả cho ổ cứngTúi có 2 ngăn: ngăn chính đựng ổ cứng, ngăn phụ nhỏ đựng dây cáp sạKích thước bên ngoài túi: 15....",54000.0,54000.0,,,,4.0,,available,,1000.0,1000.0,"Túi chống sốc 2 ngăn vải chống thấm đựng ổ cứng di động size 2.5inch, máy chụp hình du lịch, phụ kiện cáp sạc - Hàng chính hãng",710419,SmileBox
101843905,4779555530045,"       Giá Đỡ Điện Thoại livestream xem video Ổn Định Xoay 360 Độ dùng để Quay Phim Ghi Hình Đa Dụng   - Thích hợp cho bạn vừa làm việc, vừa có thể xem phim, xem youtube,   - Phần thân có thể đi...",50000.0,50000.0,,,,,,available,,1000.0,1000.0, Giá Đỡ Điện Thoại livestream xem video Ổn Định Xoay 360 Độ dùng để Quay Phim Ghi Hình Đa Dụng,111461,OEM
35347591,2986117578428,ỐP LƯNG DẺO TÍM MỜ CHỐNG SỐC CAO CẤP IPHONE XR...,29000.0,49000.0,,20000.0,41.0,6.0,,available,,1000.0,1000.0,Ốp lưng dẻo cao cấp dành cho iPhone XR - Màu tím mờ,625265,Photodesign VN
53631890,8341977528077,"Kích thước miếng lót chuột siêu rộng 90 x 40 cm, giúp game thủ thoải mái khi di chuyển tayGiúp việc điều khiển chuột nhanh nhạy và chính xác hơnSợi vải cấu trúc chống bám đặc biệt tối ưu hóa khả năn...",68000.0,68000.0,,,,863.0,,available,,1000.0,1000.0,"Miếng lót chuột, Pad chuột 90x40 cm Siêu rộng - Hàng chính hãng",549763,YORN
15665489,9930380103569,Tốc độ sạc nhanhDây Cáp Sạc Lightning Chuẩn MFi Cho iPhone Anker Lightning PowerLine Select+ A8012 0.9m / A8013 có đường kính rộng và công nghệ giảm kháng nên cho tốc độ sạc nhanh nhất sẽ giúp bạn tr...,350000.0,410000.0,,60000.0,15.0,359.0,,available,,1000.0,1000.0,Dây Cáp Sạc Li.ght.ning Chuẩn M.F.i Cho i.Phone Anker Li.ght.ning PowerLine Select+ A8012 0.9m / A8013 1.8m - Hàng Chính Hãng,50629,ANKER
63536208,3165250643180,"TÚI CHỐNG NƯỚC ĐIỆN THOẠI CAO CẤP GOODFIT GF202WPChỉ bỏ ra một khoản tiền nhỏ, bạn đã có ngay một phụ kiện thích hợp để bảo vệ “dế yêu” mỗi khi đi bơi, đi du lịch,…Khi sử dụng túi chống nước điện thoạ...",107000.0,107000.0,,,,3.0,,available,,1000.0,1000.0,"Túi chống nước điện thoại đi biển, bao đựng điện thoại chống nước cao cấp 4 lớp, đạt chuẩn chất lượng GoodFit GF202WP",856589,GOODFIT
