id,sku,short_description,price,list_price,price_usd,discount,discount_rate,review_count,order_count,inventory_status,is_visible,stock_item_qty,stock_item_max_sale_qty,product_name,brand_id,brand_name
140144656,8961352750191,"Realme đang dần nhận được sự ưa chuộng của người dùng ở phân khúc tầm trung, giá rẻ nhờ thiết kế độc đáo, đặc biệt cùng nhiều điều thú vị của hãng này, gần đây Realme đã cho ra mắt sản phẩm mới mang t...",3599000.0,4990000.0,,1391000.0,28.0,,,available,,1000.0,1000.0,Điện thoại Realme C25Y (4GB/128GB) - Hàng chính hãng,247549,Realme
253395356,1620523135120,"Điện Thoại Samsung M14 5G 6GB/128GB - Hàng Chính HãngBộ sản phẩm bao gồm: Thân máy, cáp dữ liệu, tài liệu hướng dẫn, dụng cụ lấy sim và lấy thẻ nhớ.Trải nghiệm màn hình lớn, hình ảnh tốt- Điện tho...",5292000.0,5292000.0,,,,,,available,,1000.0,1000.0,Điện Thoại Samsung M14 5G 6GB/128GB - Hàng Chính Hãng,18802,Samsung
65091422,1912696032151,"Pin quái vật 10000mAh, thời gian chờ 30 ngày với một lần sạc Lợi ích từ tối ưu hóa năng lượng của chipset, pin tích hợp 10000 mAh cho phép một lần sạc trong 750 giờ ở chế độ chờ, 52 giờ gọi, 10 gi...",6990000.0,6990000.0,,,,2.0,,available,,1000.0,1000.0,"Điện thoại Oukitel WP6 (Chống va đập,chống nước,Ram 6Gb,Rom 128Gb,pin 10.000mAh) - Hàng chính hãng",112735,Oukitel
164318521,3057890145380,• Màn hình LCD 1.8” hiển thị rõ nét.• Danh bạ lưu 100 tên và số• Lưu 50 số gọi đến*• Nhớ 10 số gọi đi• Chia sẻ danh bạ giữa máy mẹ và tay con• 9 phím gọi nhanh• Loa ngoài hai chiều trên tay con• Chế đ...,2450000.0,2450000.0,,,,6.0,,available,,1000.0,1000.0,Điện thoại bàn Panasonic KX-TGF320 hàng chính hãng,18804,Panasonic
262908601,5149165813197,"Chống nước,chống va đậpMàn hình 8“HD+,1200*800CPU--MTK Helio P22, HĐH-Android 12Android 12Pin 5150mAhRAM  4GB , ROM 64GB,Sử dụng 2 sim hoặc 1 sim,1thẻ nhớBluetooth 5.0, Bluetooth HID, GPS+Glona...",4990000.0,4990000.0,,,,,,available,,1000.0,1000.0,"Máy tính bảng chắc chắn oukitel RT3 (chống nước,chống va đập,Ram 4Gb,Rom 64 Gb,màn hình 8 inch,pin 5150 mAh)- hÀng chính hãng",112735,Oukitel
96661748,2561167451907,Điện thoại cố định không dây lắp sim là dịch vụ điện thoại cố định nhưng sử dụng SIM di động hoặc sim cố định và lắp vào máy cố định không dây giúp khách hàng có thể di chuyển sử dụng dễ dàng.- Độ bền...,800000.0,800000.0,,,,4.0,,available,,1000.0,1000.0,Điện Thoại Bàn không dây Lắp Tất Cả Các Sim Đi Động và Cố Định,111461,OEM
271134741,2623945883957,"Màn hình: 6.7"" Dynamic AMOLED 2X, FHD+ (2640 x 1080 Pixels)Hệ điều hành: Android 13Camera sau: 12 MP + 12 MPCamera trước: 10 MPChipset: Snapdragon 8 Gen 2 for GalaxyRAM: 8 GBBộ nhớ trong: 512 G...",17639000.0,29990000.0,,12351000.0,41.0,,,available,,1000.0,1000.0,Điện thoại Samsung Galaxy Z Flip5 (8GB/512GB) - Hàng chính hãng,18802,Samsung
186149961,3378484697003,"Màn hình 8.7 inch WXGA+ (1340x800) hiển thị hình ảnh rõ nét, chân thựcVPU Mediatek MT8768T cho hiệu năng ổn định, xử lý tác vụ nhanh chóngDung lượng pin 5100 mAh, sạc nhanh 15W, thoải mái trải nghiệ...",3587000.0,3587000.0,,,,,,available,,1000.0,1000.0,Máy tính bảng Samsung Galaxy Tab A7 Lite 32GB Xám - Hàng Chính Hãng,18802,Samsung
270544863,7058138486050,"Mẫu điện thoại tầm trung được hãng điện thoại Samsung vừa tung ra thị trường (04/2023) với tên gọi Samsung Galaxy A24 8GB. Máy sở hữu tấm nền Super AMOLED 6.5 inch, hiệu năng mượt mà với hầu hết mọi t...",6084000.0,6084000.0,,,,,,available,,1000.0,1000.0,Điện Thoại Samsung Galaxy A24 (8GB/128GB) - Hàng Chính Hãng,18802,Samsung
215617756,8559832616208,"Điện Thoại Samsung A14 5G 4GB/128GB - Hàng Chính HãngBộ sản phẩm bao gồm: Thân máy, cáp dữ liệu, tài liệu hướng dẫn, dụng cụ lấy sim và lấy thẻ nhớ.Trải nghiệm màn hình lớn, hình ảnh tốt - Trang bị...",5000000.0,5000000.0,,,,,,available,,1000.0,1000.0,Điện Thoại Samsung A14 5G 4GB/128GB - Hàng Chính Hãng,18802,Samsung
197651936,3575779983217,"TÍNH NĂNG NỔI BẬTThông số kỹ thuậtMàn hình Chính: 2.4 inch, QVGA, 320 x 240 PixelsRAM 48 MBBộ nhớ trong 128 MBCPU Unisoc UMS9117Mạng : 4G LTEDung lượng pin 1400 mAhThẻ sim 2 - 2 Nano SIM...",499000.0,599000.0,,100000.0,17.0,1.0,,available,,1000.0,1000.0,"Điện thoại Masstel Izi 25 4G Pin siêu khỏe, Gọi HD call- Hàng chính hãng",192229,Massel
197907038,5012695209637,"Thông tin sản phẩm Vtel E10 4GMàn hình: 1.77 inchBăng tần 2G, 3G: GSM850/900/1800/1900Băng tần 4G: B1(2100),B3(1800),B5(850),B8(900)Bộ nhớ: 48MB + 128MBDanh bạ: 2.000 sốPin: 1,000 mAhFM: Loa ng...",399000.0,399000.0,,,,29.0,,available,,1000.0,1000.0,Điện thoại di động Vtel E10 4G – Hàng Chính Hãng,573293,Vtel
273029857,9473653790591,"Đắm chìm hết cỡ vào màn hình rộng mởThỏa sức thưởng thức hình ảnh bật nét qua màn hình độ phân giải cao FHD+ rộng 6.7"", giúp cân tất mọi phim và trò chơi yêu thích của bạn với chất lượng liền mạch, ...",3980000.0,3980000.0,,,,,,available,,1000.0,1000.0,Điện Thoại Samsung Galaxy A05s (4GB/128GB) - Hàng Chính Hãng ,18802,Samsung
84757299,3004862240432,"Itel il9200 4G là một chiếc điện thoại phổ thông hỗ trợ đầy đủ các tính năng như một smartphone với các tính năng đàm thoại, quay phim chụp ảnh, đặc biệt còn hỗ trợ mạng 4G tốc độ cao, một lựa chọn h...",590000.0,590000.0,,,,,,available,,1000.0,1000.0,Điện thoại Itel it9200 4G - Hàng chính hãng,111684,Itel
261964853,3649113617170,...,5990000.0,5990000.0,,,,,,available,,1000.0,1000.0,"Điện thoại ulefone note 16 pro (Ram 16Gb(8+8),rom 128Gb,android 13 , camera 50MP,pin 4.400mAhm, Mở khóa vân tay, Mở khóa bằng khuôn mặt )-hàng chính hãng",169013,Ulefone
181918564,3063278093997,"đối với điện thoại chống nước,quý khách nên đậy thật kỹ nút sạc,khe sim,tai nghe khi sử dung    Sử dụng pin dung lượng cao 10600mAh, WP16 có thể giúp bạn không phải sạc ...",5990000.0,5990000.0,,,,,,available,,1000.0,1000.0,"Điện thoại OUKITEL WP16 (pin 10.600mAh,  Ram 8Gb,Rom 128Gb, màn hình 6,39 in , Android 11, Máy ảnh nhìn ban đêm 20MP, chống nước IP68,chống va đập, hai SIM 4G, NFC..) – hàng chính hãng",112735,Oukitel
253443951,3517813172561,ĐẶC ĐIỂM NỔI BẬTKiểu dáng hiện đại cùng nhiều lựa chọn về màu sắc giúp phù hợp với nhiều ngườiKhông gian hiển thị rộng lớn với màn hình 6.6 inch cùng tấm nền LCD thế hệ mớiChip Exynos 1330 độc qu...,5292000.0,5292000.0,,,,,,available,,1000.0,1000.0,Điện Thoại Samsung Galaxy M14 5G (6GB/128GB) - Hàng Chính Hãng,18802,Samsung
216092766,8303157889293,...,8136000.0,8136000.0,,,,,,available,,1000.0,1000.0,Điện Thoại Oppo Reno 8T 4G (8GB/256GB) - Hàng Chính Hãng,25643,OPPO
271341795,5936908417390,"TN Mobile cam kết: ️️Hàng chính hãng️1 đổi 1 trong 07 ngày đầu ️️ Sản phẩm được bảo hành 12 tháng toàn quốc Masstel Hapi 15 Thông tin sản phẩm: ️ Màu Sắc Black, Blue, Gold ️ Màn hình:5.45″ H...",1499000.0,1499000.0,,,,,,available,,1000.0,1000.0,"Điện thoại smartphone Masstel Hapi 15 (2GB/16GB) - 2 Sim, Tặng kèm ốp lưng - Hàng chính hãng - Bảo hành chính hãng",112638,Masstel
47292697,4708700031268,"Điện thoại quay số kiểu cổ điển , phù hợp với không gian cổ kính , tạo phong cách đặc biệt cho căn phòng của bạnÂm lượng chuông lớn , có thể điểu chỉnh âm to nhỏ theo mong muốnKhông sử dụng nguồn ha...",2000000.0,2000000.0,,,,,,available,,1000.0,1000.0,Điện thoại bàn cổ điển DT40,111461,OEM
31820638,2017289033924,ĐIỆN THOẠI BÀN CÓ DÂY PANASONIC KX-TS500MX•Điều chỉnh âm lượng điện tử •Chức năng quay lại số vừa gọi •Giá treo tường • Có phím FLASH - Dùng để chuyển máy nội nộ•Kiểu chuông 3 cấp độ •Cài chế độ bậ...,299000.0,299000.0,,,,13.0,,available,,1000.0,1000.0,Điện Thoại Bàn Panasonic KX-TS500MX - Panasonic KX-TS500MX Integrated Telephone System - Hàng chính hãng,18804,Panasonic
151463645,9276321567546,"Nâng tầm nhiếp ảnh điện toánTrí tuệ nhân tạo AI cùng các sáng tạo công nghệ nhiếp ảnh điện toán nổi bật: sMacro, sCorrection, sMoment, sNight… nâng cấp khả năng chụp ảnh vượt xa g...",6490000.0,6490000.0,,,,1.0,,available,,1000.0,1000.0,"Điện thoại Bphone A60 (Ram 6Gb,Rom 128 Gb,màn hình đục lổ FHD 6.7inch , pin 5.000mAh ) - Hàng chính hãng",229213,Bphone
253443894,9839325928397,ĐẶC ĐIỂM NỔI BẬTKiểu dáng hiện đại cùng nhiều lựa chọn về màu sắc giúp phù hợp với nhiều ngườiKhông gian hiển thị rộng lớn với màn hình 6.6 inch cùng tấm nền LCD thế hệ mớiChip Exynos 1330 độc qu...,4212000.0,4212000.0,,,,,,available,,1000.0,1000.0,Điện Thoại Samsung Galaxy M14 5G (4GB/128GB) - Hàng Chính Hãng,18802,Samsung
196760330,6604112406127,"Điện Thoại Vivo T1x 4GB/64GB - Hàng Chính HãngBộ sản phẩm bao gồm: Thân máy, bộ sạc, cáp USB, dụng cụ lấy sim, sách hướng dẫn, ốp lưng điện thoại.Thiết kế mỏng nhẹ, thời trang- Sở hữu thiết kế rất...",3499000.0,4490000.0,,991000.0,22.0,,,available,,1000.0,1000.0,Điện Thoại Vivo T1x 4GB/64GB - Hàng Chính Hãng,52232,Vivo
267178005,8083858187436,"Màn hình: Super AMOLED 6.5"", 1080 x 2340 pixels (FullHD+)Hệ điều hành: Android 13Camera sau: 50.0 MP + 5.0 MP + 2.0 MPCamera trước: Camera góc rộng: 13 MP, f/2.0Chipset: Mediatek MT8781...",5808000.0,5808000.0,,,,,,available,,1000.0,1000.0,Điện thoại Samsung Galaxy A24 - Hàng chính hãng,18802,Samsung
37289936,1392534010792,"​​​​Camera sau kép, tận hưởng trải nghiệm SLRWP2 được trang bị camera phía sau ống kính kép với cảm biến Samsung S5K2P7 16MP cho máy ảnh chính và camera phụ 2MP cho hiệu ứng mờ. Chụp rất chi tiế...",5490000.0,5490000.0,,,,3.0,,available,,1000.0,1000.0,"Điện thoại Oukitel WP2 chống nước,chống va đập, pin 10.000 mAh - Hàng chính hãng",112735,Oukitel
4048043,5352269298151,"Thiết kế nổi bật, tiện íchĐiện Thoại Bàn Panasonic KX-TS500 được thiết kế đơn giản, thanh thoát nhưng rất sang trọng. Với màu sắc bắt mắt KX-TS500 làm cho căn phòng của bạn thêm nổi bật. Máy thích hợ...",339000.0,369000.0,,30000.0,8.0,24.0,,available,,1000.0,1000.0,Điện Thoại Bàn Panasonic KX-TS500 - Hàng Chính Hãng,18804,Panasonic
221518066,3989665564397, ...,6042210.0,6789000.0,,746790.0,11.0,,,available,,1000.0,1000.0,Máy đọc sách Kindle Oasis 3 10th - Hàng nhập khẩu,147856,Kindle
140747649,9727507788562,vừa cho ra mắt dòng  giá rẻ tiếp theo của mình đó là . Máy có hiệu năng tốt cùng dung lượng pin lớn sẽ thích hợp với người dùng đang cần một chiếc điện thoại để có thể chiến tốt các tựa game hiện nay....,3790000.0,3790000.0,,,,,,available,,1000.0,1000.0,Điện thoại Realme C11 2021 (4GB/64GB) - Hàng chính hãng,247549,Realme
225920758,6461232536475,"Galaxy S23 Ultra (12GB/512GB) Sản xuất tại Samsung Việt NamBộ sản phẩm gồm: Cáp Type C, Cây lấy sim, Hộp, Sách hướng dẫn ...",36990000.0,36990000.0,,,,1.0,,available,,1000.0,1000.0,Điện Thoại Samsung Galaxy S23 Ultra 5G (12GB/512GB) - Hàng Chính Hãng,18802,Samsung
249782771,9173713949009,"Xelex Gama Tab X8 EDU là một thiết bị “tất cả trong một”, hoạt động với năng suất cao và là một công cụ giải trí đa phương tiện mạnh mẽ. Ngoài ra, Xelex Gama Tab X8 còn là người bạn đồng hành tốt nhất...",2890000.0,2890000.0,,,,,,available,,1000.0,1000.0,Máy tính bảng Xelex Gama Tab X8 EDU (Hàng chính hãng),8173499,XELEX
194462682,1499980384945,...,3490000.0,3490000.0,,,,,,available,,1000.0,1000.0,"Điện thoại ZTE Blade A52 4GB l 64GB, Pin 5000mAh, Màn hình 6.52"", Camera AI Triple - Hàng chính hãng",49994,ZTE
273227290,8004137347297,"Đọc và viết tự nhiên như khi làm trên giấyVới màn hình E-ink 10,2 inch, độ phân giải 300 ppi chống lóa. Kindle Scribe hoàn hảo để đọc và viết, ngay cả dưới ánh sáng mặt trời. Màn hình lớn cung c...",11276100.0,11390000.0,,113900.0,1.0,,,available,,1000.0,1000.0,"Combo Máy đọc sách Kindle Scribe kèm bút – thế hệ đầu tiên có thể đọc và viết, màn hình 10,2” 300PPI, đèn vàng warmlight, bộ nhớ 16-64GB, đồng bộ dữ liệu qua Microsoft Word - hàng nhập khẩu",147856,Kindle
65492829,9942977542729," bền bỉ hơn, Khéo léo hơn WP5 Pro sử dụng cao su công nghiệp với các yếu tố chống va đập. Bốn góc máy được làm dày dặn độ bền cao cũng như lớp vỏ thép dày và bền cũng như thiết kế ma sát lưng và ph...",3990000.0,3990000.0,,,,9.0,,available,,1000.0,1000.0,"Điện thoại Oukitel WP5 Pro (Ram4GB,Rom 64Gb,pin 8.000mAh ,chống va đập,chống nước) - hàng chính hãng",112735,Oukitel
144231179,9771092694372,"Điện thoại bàn Điện thoại cố định không dây Dòng cố định không dây lắp SIM Lắp SIM cố định hoặc SIM di động đều được Lắp tất cả các loại SIM của tất cả các thị trường hiện có Viettel, Vina, Mobi, Viet...",880000.0,880000.0,,,,4.0,,available,,1000.0,1000.0,Điện Thoại Bàn Không Dây Lắp Các Loại Sim Di Động Cố Địnḥ,111461,OEM
80132874,1512070665170,"Điện thoại thiết kế chuông quả bàn phím quay. Kích thước: 26x27x22x26cmChất liệu: gỗ sồi họa tiết tân cổ, hợp kim mạ đồngChức năng: sử dụng nghe gọi và để bàn trang tríKiểu Dáng cổ điển sang trong ph...",3600000.0,3600000.0,,,,,,available,,1000.0,1000.0,"ĐIỆN THOẠI TÂN CỔ ĐIỂN DT16 bàn phím quay chuông thanh, dùng được nghe gọi âm thanh rõ ràng. Điện thoại để bàn tân cổ điển- Điện thoại bàn chất liệu gỗ để trang trí",111461,OEM
245770806,2939191785142,"Màn hình: PLS LCD 6.6"", FHD+(1080 x 2408 Pixels)Hệ điều hành: Android 12Camera sau: 50 MP + 2 MP + 2 MPCamera trước: 13 MPChipset: Exynos 850RAM: 4 GBBộ nhớ trong: 128 GBCổng kết...",3672000.0,3672000.0,,,,,,available,,1000.0,1000.0,Điện thoại Samsung Galaxy A14 LTE (4GB/128GB) - Hàng chính hãng,18802,Samsung
204802771,4258063848951," Màn hình: IPS LCD 6.56"", 720 x 1612 Pixels Hệ điều hành: Android 12 Camera sau: 13 MP + 2 MP Camera trước: 8 MP Chipset: Helio G35 RAM: 4 GB Bộ nhớ trong: 128 GB Cổng kết nối/sạ...",4632000.0,4632000.0,,,,,,available,,1000.0,1000.0,Điện thoại Oppo A57 (4GB/128GB) - Hàng chính hãng,25643,OPPO
176438844,8022266566422,"Thiết kế hiện đại, thời thượngGiống như người anh Redmi 9 của mình, Xiaomi Redmi 9A được trang bị màn hình giọt nước tràn viền kích thước lớn 6.53 inch tỉ lệ 20:9 cho khả năng hiển thị được nhiều th...",2088000.0,2088000.0,,,,,,available,,1000.0,1000.0,Điện thoại Xiaomi REDMI 9A (2+32) Xanh lá - Hàng chính hãng (chỉ giao HN và một số khu vực),25422,Xiaomi
217158529,7142629584422,"Máy tính bảng Samsung Galaxy Tab A7 Lite là phiên bản rút gọn của dòng tablet ""ăn khách"" Galaxy Tab A7 thuộc thương hiệu Samsung, đáp ứng nhu cầu giải trí của khách hàng thuộc phân khúc bình d...",3587000.0,3587000.0,,,,,,available,,1000.0,1000.0,Máy tính bảng Samsung Galaxy Tab A7 Lite - Hàng chính hãng,18802,Samsung
5868813,5499695984248,"Thiết kế đỉnh caoĐiện Thoại Bphone 3 - Hàng Chính Hãng là smartphone android đầu tiên có thiết kế Tràn đáy với viền đều hai bên và đáy rất mỏng, chỉ 2.25mm, mỏng nhất hiện nay. Bphone 3 cho cảm giác ...",6990000.0,6990000.0,,,,,,available,,1000.0,1000.0,Điện Thoại Bphone 3 - Hàng Chính Hãng,229213,Bphone
181216830,1010023037880,"Tại MWC 2022, ZTE tiếp tục cho ra mắt series smartphone ZTE Blade V40 với 3 mẫu bao gồm: ZTE Blade V40 Pro, ZTE Blade V40 5G và ZTE Blade V40 Vita Trong bộ tứ smartphone này, Blade V40 Vita là thiết b...",4290000.0,4290000.0,,,,,,available,,1000.0,1000.0,"Điện thoại ZTE Blade V40 Vita (ZTE 8045) - MH giọt nước HD+ 6.75"" - Pin 6000 mAh sạc nhanh 22.5W -  Bộ nhớ mở rộng (4+2)GB - Hàng chính hãng",49994,ZTE
73842403,1564292890033,điện thoại bàncó dây kiểu dáng nhỏ gọnsố to rõ dễ sử dụng  ...,250000.0,250000.0,,,,15.0,,available,,1000.0,1000.0,Điện thoại bàn có dây nhỏ gọn màu trắng,111461,OEM
216934468,8447409465970,"Màn hình: 6.6"" PLS LCD, FHD+ (1080 x 2408 Pixels)Hệ điều hành: Android 13Camera sau: 50 MP + 2 MP + 2 MPCamera trước: 13 MPChipset: MediaTek Dimensity 700RAM: 4 GBBộ nhớ trong: 128 ...",5000000.0,5000000.0,,,,1.0,,available,,1000.0,1000.0,Điện thoại Samsung Galaxy A14 5G (4GB/128GB) - Hàng chính hãng,18802,Samsung
191636459,7249711385944,"Thông tin sản phẩmTên sản phẩm: Masstel IZI 11 4GKiểu dáng mạnh mẽKích thước: 125*42*14mm, trọng lượng 95gMàu sắc: Xanh Đen, Đỏ ĐenMàn hình màu TFT rộng 1.77 inchKết nối mạng 4GCamera: VGAHỗ t...",468000.0,468000.0,,,,,,available,,1000.0,1000.0,Điện thoại Masstel IZI 11 4G - Hàng chính hãng,112638,Masstel
176909016,7078791113052,"THÔNG SỐ KỸ THUẬT:Hệ điều hành: Android 11Chip xử lý (CPU): Quad Core 2.0GhzRAM: 4GB DDRROM: 32GSIM 4G-LTE, Wi-FiKích thước màn hình: 10.1”Dung lượng Pin: 5.000 mAhCamera: 5+2MPBẢO HÀNH: Máy tính bản...",3300000.0,3300000.0,,,,,,available,,1000.0,1000.0,Máy tính bảng HANET Smart Edu Tablet Model T432 - Hàng Chính Hãng,281391,HANET
215543460,9548602227692,"Thông tin hàng hóaThương hiệu:  SamsungXuất xứ:   Việt NamThời điểm ra mắt:  01/2023Thời gian bảo hành (tháng):  12Hướng dẫn bảo quản:  Để nơi khô ráo, nhẹ tay, dễ vỡ.Hướng dẫn sử dụng:  Xem ...",5190000.0,5190000.0,,,,1.0,,available,,1000.0,1000.0,Điện Thoại Samsung Galaxy A14 5G (4GB/128GB) - Hàng Chính hãng,18802,Samsung
171852890,9165946277319,"Masstel Fami 60 là chiếc điện thoại phổ thông dành tặng riêng cho người cao tuổi với thiết kế gọn gàng, màn hình rõ nét và cụm loa ngoài cực lớn cùng pin “siêu trâu”lên đến 2000mAh, thời gian chờ lên ...",689000.0,689000.0,,,,,,available,,1000.0,1000.0,"Điện thoại Masstel FAMI 60 4G ,Pin 2000 mah ,cỡ chữ to rõ ràng,âm thanh lớn,màn hình to- Hàng chính hãng",112638,Masstel
21317020,1707684225376,"Dù với sự phát triển ngày càng mạnh mẽ và thông dụng của điện thoại di động, nhưng chiếc điện thoại bàn vẫn luôn gắn bó và có mặt trong mọi gia đình Việt. Điện thoài bàn ngày nay đã được cải tiến với ...",2290000.0,2290000.0,,,,11.0,,available,,1000.0,1000.0,Điện thoại bàn không dây Panasonic KX-TGF310 - Hàng Chính Hãng,18804,Panasonic
147969070,6793153411247,"Điện thoại Itel A26 được ra mắt vào ngày 22 tháng 9 năm 2021 sở hữu ngoại hình đẹp với cấu hình tốt với mức giá cực tốt, chạy trên hệ điều hành Android 10 (Go Edition) mượt mà.Ngoại hình được trau ...",2390000.0,2390000.0,,,,1.0,,available,,1000.0,1000.0,"Điện thoại thông minh itel A26  2 Sim 2 Sóng 4G LTE - Màn hình IPS 5.7"" - RAM 2GB + ROM 32 GB - Mở khoá bằng Gương Mặt -  Hàng chính hãng ",111684,Itel
248185228,3280761577479,"Điện Thoại Masstel Lux 10 4G - Hàng Chính HãngBộ sản phẩm bao gồm: Thân máy, pin, sạc, sách hướng dẫn sử dụng,vỏ hộp. Màn hình hiển thị tốt- Với kích thước màn hình 2.4 inch được trang bị trên tấm...",675000.0,675000.0,,,,,,available,,1000.0,1000.0,Điện Thoại Masstel Lux 10 4G - Hàng Chính Hãng,112638,Masstel
188030974,6509906931474,"bạn phải đậy thật kỹ nút sạc ,khe sim khi sử để đi mưa,rớt nướước không vô máy được, tuyệt đối không ngâm vào thùng đá vì hơi nước sẻ hình thành bên trong máMáy tính bảng chắc chắn ,chống sốc ,chống ...",6990000.0,6990000.0,,,,,,available,,1000.0,1000.0,"Máy tính bảng Oukitel RT1 - hàng chính hãng  (chống nước,chống va đập , pin khủng,pin 10.000mAh,màn hình 10,1 inch,Ram 4Gb,Rom 64Gb,tám nhân,học online)",112735,Oukitel
4059671,5074757709115,Khả năng ghi nhớ số điện thoạiĐiện Thoại Bàn Panasonic KXTS 520 được lắp đặt một công nghệ tiên tiến thông minh cho khả năng nhớ số điện thoại mà bạn đã liên lạc trong một khoảng thời gian nhất định....,469000.0,489000.0,,20000.0,4.0,11.0,,available,,1000.0,1000.0,Điện Thoại Bàn Panasonic KXTS 520 - Hàng Chính Hãng,18804,Panasonic
197045354,6899590311483,"-Nổi bật với phong cách ĐIỆN THOẠI LUX 20 4G ,được thiết kế sang trọng với viền kim loại -sở hữu nhiều ưu điểm vượt trội và mang đến nhiều giá trị hoàn toàn mới cho người dùng.+nàn hình 2.4 inch có ...",750000.0,750000.0,,,,,,available,,1000.0,1000.0,ĐIỆN THOẠI MASSTEL LUX 20-4G  HÀNG CHÍNH HÃNG,112638,Masstel
217559440,3550902805970,"Màn hình: PLS IPS 6.5"" HD+ Hệ điều hành: Android 11 Camera chính: 13MP + 2MP + 2MP Camera trước: 5MP Chipset: MediaTek Helio P35 RAM: 3 GB Bộ nhớ trong: 32 GB Cổng sạc: USB Type-...",2990000.0,2990000.0,,,,,,available,,1000.0,1000.0,Điện thoại Samsung Galaxy A03s (3GB/32GB) - Hàng chính hãng,18802,Samsung
189658085,3358216947846,  ...,4284000.0,4284000.0,,,,,,available,,1000.0,1000.0,Điện Thoại Oppo A57 (4GB/64GB) - Hàng Chính Hãng,25643,OPPO
160434731,4022909547242,"Máy Tính Bảng Samsung Galaxy Tab A8 4GB/64GB - Hàng Chính HãngBộ sản phẩm bao gồm: Thân máy, sạc, cáp dữ liệu, tài liệu hướng dẫn sử dụng, dụng cụ lấy sim và lấy thẻ nhớ. Màn hình lớn hiển thị nhiề...",5856000.0,5856000.0,,,,,,available,,1000.0,1000.0,Máy Tính Bảng Samsung Galaxy Tab A8 4GB/64GB - Hàng Chính Hãng,18802,Samsung
258787119,1708751232564,"HÀNG CHÍNH HÃNG,FULL BOX,NGUYÊN SEAL,BẢO HÀNH 1 NĂMMáy Tính Bảng Chắc Chắn mạnh Nhất thế giới Màn Hình FHD + , 10.1 in ,Pin 20000mAh , tiêu chuẩn IP68 & IP69K & MIL-STD-810H/Mediatek MT8788...",8990000.0,8990000.0,,,,,,available,,1000.0,1000.0,"Máy tính bảng OUKITEL RT2 chắc chắn (chống nước,chống va đập ,pin xài lâu,Pin  20.000Mah, Màn hình  10,1 inch,Ram 8GB,Rom  128 GB, lõi tám nhân,Máy ảnh 16MP,Android 12,sạc nhanh 33W)- hàng chính hãng",112735,Oukitel
174085242,4949250638699,"Điện Thoại Cho Người Già Masstel Fami 12 4G - Viền Kim Loại, Công Tắc Bật Đèn, Ăng Ten Nghe FM Không Dây, MỚI, CHÍNH HÃNG 100% được phân phối chính thức tại DI ĐỘNG IZI. ➤ Thiết kế bắt mắt, viền kim...",612000.0,699000.0,,87000.0,12.0,1.0,,available,,1000.0,1000.0,"Điện Thoại Cho Người Già Masstel Fami 12 4G - Viền Kim Loại, Ăng Ten FM Không Dây - Hàng Chính Hãng",112638,Masstel
196176544,7750175317187," Điện thoại người lớn tuổi Masstel Fami 12 4G 2 Sim : loa to , pin trâu, sóng khỏe có đèn Pin siêu sángCông nghệ màn hình:TFT LCDĐộ phân giải:128 x 160 PixelsMàn hình rộng:1.77""Mặt kính cảm ứn...",630000.0,630000.0,,,,,,available,,1000.0,1000.0,Điện Thoại Cho Người Già Masstel Fami 12 4G-hỗ trợ 4g-chữ to dành cho người già(Hàng Chính Hãng),112638,Masstel
157835051,9303391315618,ĐIỆN THOẠI BÀN CÓ DÂY PANASONIC KX-TS500MX•Điều chỉnh âm lượng điện tử •Chức năng quay lại số vừa gọi •Giá treo tường • Có phím FLASH - Dùng để chuyển máy nội nộ•Kiểu chuông 3 cấp độ •Cài chế độ bậ...,380000.0,380000.0,,,,1.0,,available,,1000.0,1000.0,Điện Thoại Để Bàn Panasonic KX-TS500MX - Hàng Chính Hãng,18804,Panasonic
